{"description":"Two practice boards per lesson, each filtered to require its lesson's argument. Academy boards are unrated.","id":"academy-1","puzzles":[{"file":"../puzzles/bf1-5x5-000003.json","id":"bf1-5x5-000003","sha256":"1571471dbe09fed285a589fef2740b6ebc33fae049ed2430ff595f4ac7b14c75"},{"file":"../puzzles/bf1-5x5-000004.json","id":"bf1-5x5-000004","sha256":"500b94e62ffe58dfeb2d4082d0fbe8a34cfac35b2803a1842e496fe4707ec46e"},{"file":"../puzzles/bf1-5x5-000005.json","id":"bf1-5x5-000005","sha256":"005bd64e312260cef3a8221a20697e7b2718bbb908f1ceae19994b04c0f4a721","technique":"clue_reached_too_fast"},{"file":"../puzzles/bf1-5x5-000006.json","id":"bf1-5x5-000006","sha256":"3ff6d179dbde84d2bcdc19be2cdad0ba75740f93e155be20b63b8d5746145502","technique":"clue_reached_too_fast"},{"file":"../puzzles/bf1-5x5-000007.json","id":"bf1-5x5-000007","sha256":"4d8a75fcfcdbd82086c63b07601e923e02dd8bc6d441b6698db873b711a0459b","technique":"clue_unreachable_in_time"},{"file":"../puzzles/bf1-5x5-000008.json","id":"bf1-5x5-000008","sha256":"301d9e1a22db02c1fe282331e4ff507d77cb74f758187968295732dd21404fa2","technique":"clue_unreachable_in_time"},{"file":"../puzzles/bf1-5x5-000009.json","id":"bf1-5x5-000009","sha256":"5d96b1239bef777c28a213fbb160ba27f2bdcfa4d3d94370c2e53c143694a66f","technique":"clue_unreachable_in_time"},{"file":"../puzzles/bf1-5x5-000010.json","id":"bf1-5x5-000010","sha256":"39ef3bc4620246fc96de25a3626754edc3d5044af5cf33e046e48b14e19331bc","technique":"clue_unreachable_in_time"},{"file":"../puzzles/bf1-6x6-000004.json","id":"bf1-6x6-000004","sha256":"4b7395e75d30f17c12d30d2b2e7f51b28bab8456aaa997f189ac1088d62d6efa","technique":"clue_unreachable_in_time"},{"file":"../puzzles/bf1-6x6-000005.json","id":"bf1-6x6-000005","sha256":"6e532fb3406ae1747984b2a7165d239603f298fb1bfbdb08d0daee2fdadff3f0","technique":"clue_unreachable_in_time"},{"file":"../puzzles/bf1-5x5-000011.json","id":"bf1-5x5-000011","sha256":"5ad1c3ca527d88e2f72fd22ff1eb4d8459613e8334438af7bf2378eaacd0521e","technique":"all_breaks_placed"},{"file":"../puzzles/bf1-5x5-000012.json","id":"bf1-5x5-000012","sha256":"3ab6d95425a3f12670b352b92efcb2f476bfd0c674bac00e4faf1381eee281f5","technique":"all_breaks_placed"},{"file":"../puzzles/bf1-7x7-000002.json","id":"bf1-7x7-000002","sha256":"1f6610e10aaae746221f05930e8281945b9fa52d3aca309d162fcf92b9f19ebf"},{"file":"../puzzles/bf1-7x7-000003.json","id":"bf1-7x7-000003","sha256":"cbd364e68a7815ef4ea33152df5b6129766db9e9bfce3b188f2764c87ff43b96"}],"schema":"burnfront.pack/1","title":"The Academy \u2014 practice boards"}
